{
  "artifact": "codex-fusion-artifact",
  "files": [
    {
      "path": ".github/workflows/verify.yml",
      "sha256": "7acffb2a53650c834fddbd4824f146203cc76897b3e7208e8f913cd9339c0c16",
      "size_bytes": 398
    },
    {
      "path": ".gitignore",
      "sha256": "bc257a72ab49a2fff62594dae908de0df4c409cce7b7c83120a662fcda89cab2",
      "size_bytes": 64
    },
    {
      "path": "CITATION.cff",
      "sha256": "19baeaffd979a9ac84b0e21196f8c898e3a2e433d42cd56abbe1348f578b4a93",
      "size_bytes": 387
    },
    {
      "path": "LIMITATIONS.md",
      "sha256": "5cbcf04897286f95ef3bc97cbc93ef75bc85145d836b993a6d2d654684949018",
      "size_bytes": 3179
    },
    {
      "path": "NOTICE.md",
      "sha256": "b47f10435a72744de22be8ce04f902fee009dcc864ba58611931dbad48395a9e",
      "size_bytes": 561
    },
    {
      "path": "PROVENANCE.md",
      "sha256": "9d45de5ae82028ddeb3564851c6fe4288916a9478ef6b457bc26f9442cc05d30",
      "size_bytes": 3891
    },
    {
      "path": "README.md",
      "sha256": "7eead0497414cbd82aa9032defe59d261413c07386e05913464ea5e8cadffcb4",
      "size_bytes": 4966
    },
    {
      "path": "REPRODUCE.md",
      "sha256": "2de3fa5d6ef668a93cd1bc180754034206c8819979948cd29f511cd00b1a527f",
      "size_bytes": 1370
    },
    {
      "path": "SECURITY.md",
      "sha256": "b4f8af6d79fb52b8fe8087887c00f667647b1e8bac87c2d57b61dc62670024f5",
      "size_bytes": 1322
    },
    {
      "path": "analysis/report.py",
      "sha256": "41c95efdd553b2d1eb867a0aea02d4a5bc2a81cdb677259c128abef5954838d7",
      "size_bytes": 1291
    },
    {
      "path": "docs/FINDINGS.md",
      "sha256": "3f534f86c5b5e7003194fa1a6be772f7f44a02d563a3c2a78b9d1ccfba51ac3b",
      "size_bytes": 2167
    },
    {
      "path": "docs/LESSONS.md",
      "sha256": "9c7cd2a6246b11121d4ee0105a7fac28ca5e52515119b61c804c2da3412f622a",
      "size_bytes": 800
    },
    {
      "path": "docs/METHODOLOGY.md",
      "sha256": "1ea54ab6632ac597e0376a196164860ffc94cfe660b802a958df374c0957769a",
      "size_bytes": 2951
    },
    {
      "path": "evidence/README.md",
      "sha256": "9f374442d7823a480091ecb5ab5f1793555a11a8019b7da3a551015910981f41",
      "size_bytes": 577
    },
    {
      "path": "evidence/campaign-summary.json",
      "sha256": "c72c1e89059cc322a92874df8d6ac3bd962002815d90a529161f583e0fdbfaae",
      "size_bytes": 2755
    },
    {
      "path": "evidence/deep-swe/ctrf.json",
      "sha256": "f1404504132ec822ac96ae162019940353649a2dbbf8a3fb5ef79bcd08e2111b",
      "size_bytes": 16123
    },
    {
      "path": "evidence/deep-swe/evidence.json",
      "sha256": "500e7cb83c81f6dddf978c0e1479a115f551fa169794842b793e59f23cea11d2",
      "size_bytes": 507
    },
    {
      "path": "evidence/deep-swe/host-result-receipt.json",
      "sha256": "8b7df43e0a65b5b8b82fc62ce92ae6e5f5066cd42660056065dd66f6a9414cd6",
      "size_bytes": 2470
    },
    {
      "path": "evidence/deep-swe/preflight-observation.json",
      "sha256": "fe52cfeb73f6c768d99933d94911aa41d325f1d7f473837001bce46e242d4393",
      "size_bytes": 1187
    },
    {
      "path": "evidence/deep-swe/reward.json",
      "sha256": "a1a6e7d91692a9345fe8bb53c715f3b0c0b7bcd250c92aa0f6ee1495713b9fcf",
      "size_bytes": 138
    },
    {
      "path": "evidence/runs/codex-0144-frontier-smoke-001/execution-handoff.json",
      "sha256": "b520d0a31e4740887283e9e0bc0efebfff5a0bb8b8171fcc950d67b7e7c1de04",
      "size_bytes": 51185
    },
    {
      "path": "evidence/runs/codex-0144-frontier-smoke-001/gate-0.json",
      "sha256": "51db708dfce54920ca533bc289e2617f54938eb275fa7c37f8b36274ecb3df00",
      "size_bytes": 19996
    },
    {
      "path": "evidence/runs/codex-0144-frontier-smoke-001/gate-1.json",
      "sha256": "5805c808c57cdb7fd88f8d1086a9d1287f0a2d786337d1f0c8d11209b04672c6",
      "size_bytes": 13804
    },
    {
      "path": "evidence/runs/codex-0144-frontier-smoke-001/judge.json",
      "sha256": "f54baea16b82f719eabaff82453dba7183b8674daece0b992b03b1561ca235b9",
      "size_bytes": 16332
    },
    {
      "path": "evidence/runs/codex-0144-frontier-smoke-001/ledger.json",
      "sha256": "c14dd6695f62c998ae49889225a49f7170b6b054f32ca58912217ca0c696aa11",
      "size_bytes": 15215
    },
    {
      "path": "evidence/runs/codex-0144-frontier-smoke-001/manifest.json",
      "sha256": "d2946d6cd3bb7714cacff5855de848ab0871497c76b89d12d44b4cba03c26283",
      "size_bytes": 1305
    },
    {
      "path": "evidence/runs/codex-0144-frontier-smoke-001/panel.json",
      "sha256": "bf3c49c91afb234898e91a21c486dbfdd5e26462b1f0817a75ffc3b1eb0b8eb6",
      "size_bytes": 53365
    },
    {
      "path": "evidence/runs/codex-0144-frontier-smoke-001/responses/04b9bc54c0c85f1ba51678e92b7bacc329fafd569c5d676bc8472e76de52765e.json",
      "sha256": "fce9639438d70bf7c8c1d00c2d6a3611b45c0bbe7afc033445cfd4e823a3cbbc",
      "size_bytes": 9960
    },
    {
      "path": "evidence/runs/codex-0144-frontier-smoke-001/responses/4d6d7e56e86b44c2a5a79f32147828e83ae67b20011390cfde4ea7b45e092fef.json",
      "sha256": "ca004d79b5c2ebed560393192139a4f61da96914c78519577338be5ec4fa0cb4",
      "size_bytes": 15948
    },
    {
      "path": "evidence/runs/codex-0144-frontier-smoke-001/responses/5e971580e608c6dfa205d00d310992031bd5a5d4fda4e183d37901e897731545.json",
      "sha256": "e0ccabf2687fcaf317bc712ddf244cd30bcf8ccd13525626de0606ca19ef9b12",
      "size_bytes": 8916
    },
    {
      "path": "evidence/runs/codex-0144-frontier-smoke-001/responses/8fd825d441409da5c6d08da18135fe1d762845d69fbe5fa5d365a1ed1ff27f1e.json",
      "sha256": "ea982d6aff2a8a6ecaf78c69f99f3cd8b7c24d462a61f87e35837f49e97b5739",
      "size_bytes": 4603
    },
    {
      "path": "evidence/runs/codex-0144-frontier-smoke-001/responses/9b2c309ead000c3ff09f74ea5c14d70a2be75bfdad0b286c228b495553455eb5.json",
      "sha256": "859333fef262ff4c182c8ebc1efc22f030aeca58ce4153e2580694f3e2a391ed",
      "size_bytes": 8931
    },
    {
      "path": "evidence/runs/codex-0144-frontier-smoke-001/responses/a7c9fe17e4ebe6997882945d6558884eba0cafbe956422103f6665585855cfe7.json",
      "sha256": "1e885fcec94bafe072bd5def75dd641f0a6428664115b7d01e52221e629d67d5",
      "size_bytes": 5674
    },
    {
      "path": "evidence/runs/codex-0144-frontier-smoke-001/responses/b7335aca65ce15d225d3b81e9f322e6ea476496a5056fe9065088da3b654f99f.json",
      "sha256": "549015b2392858c6ddef06aa197a0b107db0ab8d5d4229b86cea2092f242d6eb",
      "size_bytes": 4109
    },
    {
      "path": "evidence/runs/codex-0144-frontier-smoke-001/responses/d33b145f985b0299311bfb8046f66ac3bbf013b7433702910bcfc5c3fe7cac7e.json",
      "sha256": "dfdd55ce9c142ea1f9112f3753347b8637505346cd2033a50c63631980fefed3",
      "size_bytes": 9339
    },
    {
      "path": "evidence/runs/codex-0144-frontier-smoke-001/responses/f19cae745199fc71565e9cbdb021bab1a41a1046516dabd26469f687a6c14026.json",
      "sha256": "40d46ca9bd4e632f772437482d2c638b4f90c5b6a6de82a9384ca986c80eadfc",
      "size_bytes": 4809
    },
    {
      "path": "evidence/runs/codex-0144-frontier-smoke-001/responses/fb9e94031ea359456552ec87fbc478050b13812384b1b5df88d476b65bb66035.json",
      "sha256": "e8d7c116f9067f65d3b66c858aab1002b00cd5fff8bd60193d5950a6ea4ed178",
      "size_bytes": 19931
    },
    {
      "path": "evidence/runs/codex-0144-frontier-smoke-001/synthesis-amendment-1.json",
      "sha256": "9b79ddcacfc2d6f71921b2f8c5f459b05ac1eb8aac56e496e354706e5823a78c",
      "size_bytes": 37659
    },
    {
      "path": "evidence/runs/codex-0144-frontier-smoke-001/synthesis.json",
      "sha256": "fa46fcb35660f74364533d773ca7845fa17fe65b6ae214a84a89872880bed229",
      "size_bytes": 29702
    },
    {
      "path": "evidence/terminal-bench/ctrf.json",
      "sha256": "ea1a92afd4b4ecb3834b584984cd04f1fb22995707f17c267e05b3a93a44e2be",
      "size_bytes": 1090
    },
    {
      "path": "evidence/terminal-bench/current-validator-observation.json",
      "sha256": "ac12e1063eb0f89ba1365cc2e10416872d597778c73a096a6cd25f08fc6bfaa3",
      "size_bytes": 1181
    },
    {
      "path": "evidence/terminal-bench/evidence.json",
      "sha256": "9b268f0dbf5dc55872793bfc0c63e5b78440b468bf7c27a8678191049619931b",
      "size_bytes": 1943
    },
    {
      "path": "evidence/terminal-bench/host-result-receipt.json",
      "sha256": "61eacb3c56a0c2876885a0619fc9566bc31b81e868e98cb510fa8b50f68587ae",
      "size_bytes": 2229
    },
    {
      "path": "evidence/terminal-bench/reward.txt",
      "sha256": "4355a46b19d348dc2f57c046f8ef63d4538ebb936000f3c9ee954a27460dd865",
      "size_bytes": 2
    },
    {
      "path": "evidence/terminal-bench/ri/benchmark-final/ledger.json",
      "sha256": "3d4db4e59318b7e0c29cd6a90032955e4e46df79b3c3bec931957873d84212f4",
      "size_bytes": 3431
    },
    {
      "path": "evidence/terminal-bench/ri/benchmark-final/manifest.json",
      "sha256": "677ececa72811f93cb90daffedbd685118a1ab4c82c61be74008da3830f5b6fe",
      "size_bytes": 570
    },
    {
      "path": "evidence/terminal-bench/ri/benchmark-fuse/ledger.json",
      "sha256": "a50b45938b4ef8275af87471a594e51126642fe357040e21cebe9c9c5d5ae5cc",
      "size_bytes": 10806
    },
    {
      "path": "evidence/terminal-bench/ri/benchmark-fuse/manifest.json",
      "sha256": "31607b64c923973ae743b9af73d13679216a0750b8432fb5fa7badf96b792f89",
      "size_bytes": 991
    },
    {
      "path": "evidence/terminal-bench/ri/benchmark-plan/ledger.json",
      "sha256": "5c8b79f53edd112f0821a3790f33e73460342d8820d32690022133d13f784563",
      "size_bytes": 3425
    },
    {
      "path": "evidence/terminal-bench/ri/benchmark-plan/manifest.json",
      "sha256": "332725a35fd4a686b75ac088431557a0803af3809253623ebbd288ef2270b487",
      "size_bytes": 569
    },
    {
      "path": "evidence/terminal-bench/ri/benchmark-post-execution/ledger.json",
      "sha256": "223215d96852d46fbb72574ed0f1428ef87ea284e9056dfe8085d810c09a0a3d",
      "size_bytes": 3426
    },
    {